{
  "$schema": "../schema/docs/locales.schema.json",
  "schema_version": 1,
  "source_locale": "zh-CN",
  "locales": [
    { "code": "zh-CN", "name": "简体中文", "root": "docs/zh-CN/README.md" },
    { "code": "en", "name": "English", "root": "docs/en/README.md" },
    { "code": "ja", "name": "日本語", "root": "docs/ja/README.md" },
    { "code": "es", "name": "Español", "root": "docs/es/README.md" }
  ],
  "topics": [
    { "id": "home", "translations": { "zh-CN": { "path": "docs/zh-CN/README.md", "status": "complete" }, "en": { "path": "docs/en/README.md", "status": "complete" }, "ja": { "path": "docs/ja/README.md", "status": "complete" }, "es": { "path": "docs/es/README.md", "status": "complete" } } },
    { "id": "installation", "translations": { "zh-CN": { "path": "docs/zh-CN/user/installation.md", "status": "complete" }, "en": { "path": "docs/en/user/installation.md", "status": "complete" }, "ja": { "path": "docs/ja/user/installation.md", "status": "complete" }, "es": { "path": "docs/es/user/installation.md", "status": "complete" } } },
    { "id": "configuration", "translations": { "zh-CN": { "path": "docs/zh-CN/user/configuration.md", "status": "complete" }, "en": { "path": "docs/en/user/configuration.md", "status": "complete" }, "ja": { "path": "docs/ja/user/configuration.md", "status": "complete" }, "es": { "path": "docs/es/user/configuration.md", "status": "complete" } } },
    { "id": "quick-start", "translations": { "zh-CN": { "path": "docs/zh-CN/user/quick-start.md", "status": "complete" }, "en": { "path": "docs/en/user/quick-start.md", "status": "complete" }, "ja": { "path": "docs/ja/user/quick-start.md", "status": "complete" }, "es": { "path": "docs/es/user/quick-start.md", "status": "complete" } } },
    { "id": "resources", "translations": { "zh-CN": { "path": "docs/zh-CN/user/resources.md", "status": "complete" }, "en": { "path": "docs/en/user/resources.md", "status": "complete" }, "ja": { "path": "docs/ja/user/resources.md", "status": "complete" }, "es": { "path": "docs/es/user/resources.md", "status": "complete" } } },
    { "id": "operations", "translations": { "zh-CN": { "path": "docs/zh-CN/user/operations.md", "status": "complete" }, "en": { "path": "docs/en/user/operations.md", "status": "complete" }, "ja": { "path": "docs/ja/user/operations.md", "status": "complete" }, "es": { "path": "docs/es/user/operations.md", "status": "complete" } } },
    { "id": "update-recovery", "translations": { "zh-CN": { "path": "docs/zh-CN/user/update-recovery.md", "status": "complete" }, "en": { "path": "docs/en/user/update-recovery.md", "status": "complete" }, "ja": { "path": "docs/ja/user/update-recovery.md", "status": "complete" }, "es": { "path": "docs/es/user/update-recovery.md", "status": "complete" } } },
    { "id": "data-transfer", "translations": { "zh-CN": { "path": "docs/zh-CN/user/data-transfer.md", "status": "complete" }, "en": { "path": "docs/en/user/data-transfer.md", "status": "complete" }, "ja": { "path": "docs/ja/user/data-transfer.md", "status": "complete" }, "es": { "path": "docs/es/user/data-transfer.md", "status": "complete" } } },
    { "id": "troubleshooting", "translations": { "zh-CN": { "path": "docs/zh-CN/user/troubleshooting.md", "status": "complete" }, "en": { "path": "docs/en/user/troubleshooting.md", "status": "complete" }, "ja": { "path": "docs/ja/user/troubleshooting.md", "status": "complete" }, "es": { "path": "docs/es/user/troubleshooting.md", "status": "complete" } } },
    { "id": "support", "translations": { "zh-CN": { "path": "docs/zh-CN/community/support.md", "status": "complete" }, "en": { "path": "docs/en/community/support.md", "status": "complete" }, "ja": { "path": "docs/ja/community/support.md", "status": "complete" }, "es": { "path": "docs/es/community/support.md", "status": "complete" } } },
    { "id": "issues", "translations": { "zh-CN": { "path": "docs/zh-CN/community/issues.md", "status": "complete" }, "en": { "path": "docs/en/community/issues.md", "status": "complete" }, "ja": { "path": "docs/ja/community/issues.md", "status": "complete" }, "es": { "path": "docs/es/community/issues.md", "status": "complete" } } },
    { "id": "contributing", "translations": { "zh-CN": { "path": "docs/zh-CN/community/contributing.md", "status": "complete" }, "en": { "path": "docs/en/community/contributing.md", "status": "complete" }, "ja": { "path": "docs/ja/community/contributing.md", "status": "complete" }, "es": { "path": "docs/es/community/contributing.md", "status": "complete" } } },
    { "id": "pull-requests", "translations": { "zh-CN": { "path": "docs/zh-CN/community/pull-requests.md", "status": "complete" }, "en": { "path": "docs/en/community/pull-requests.md", "status": "complete" }, "ja": { "path": "docs/ja/community/pull-requests.md", "status": "complete" }, "es": { "path": "docs/es/community/pull-requests.md", "status": "complete" } } },
    { "id": "architecture", "translations": { "zh-CN": { "path": "docs/zh-CN/development/architecture.md", "status": "complete" }, "en": { "path": "docs/en/development/architecture.md", "status": "complete" }, "ja": { "path": "docs/ja/development/architecture.md", "status": "complete" }, "es": { "path": "docs/es/development/architecture.md", "status": "complete" } } },
    { "id": "interface-guidelines", "translations": { "zh-CN": { "path": "docs/zh-CN/development/interface-guidelines.md", "status": "complete" }, "en": { "path": "docs/en/development/interface-guidelines.md", "status": "complete" }, "ja": { "path": "docs/ja/development/interface-guidelines.md", "status": "complete" }, "es": { "path": "docs/es/development/interface-guidelines.md", "status": "complete" } } },
    { "id": "testing", "translations": { "zh-CN": { "path": "docs/zh-CN/development/testing.md", "status": "complete" }, "en": { "path": "docs/en/development/testing.md", "status": "complete" }, "ja": { "path": "docs/ja/development/testing.md", "status": "complete" }, "es": { "path": "docs/es/development/testing.md", "status": "complete" } } },
    { "id": "contracts", "translations": { "zh-CN": { "path": "docs/zh-CN/development/contracts.md", "status": "complete" }, "en": { "path": "docs/en/development/contracts.md", "status": "complete" }, "ja": { "path": "docs/ja/development/contracts.md", "status": "complete" }, "es": { "path": "docs/es/development/contracts.md", "status": "complete" } } },
    { "id": "catalog-source", "translations": { "zh-CN": { "path": "docs/zh-CN/development/catalog-source.md", "status": "complete" }, "en": { "path": "docs/en/development/catalog-source.md", "status": "complete" }, "ja": { "path": "docs/ja/development/catalog-source.md", "status": "complete" }, "es": { "path": "docs/es/development/catalog-source.md", "status": "complete" } } },
    { "id": "releases", "translations": { "zh-CN": { "path": "docs/zh-CN/development/releases.md", "status": "complete" }, "en": { "path": "docs/en/development/releases.md", "status": "complete" }, "ja": { "path": "docs/ja/development/releases.md", "status": "complete" }, "es": { "path": "docs/es/development/releases.md", "status": "complete" } } },
    { "id": "changelog", "translations": { "zh-CN": { "path": "docs/zh-CN/CHANGELOG.md", "status": "complete" }, "en": { "path": "docs/en/CHANGELOG.md", "status": "complete" }, "ja": { "path": "docs/ja/CHANGELOG.md", "status": "complete" }, "es": { "path": "docs/es/CHANGELOG.md", "status": "complete" } } }
  ]
}
